{"type":"config","name":"Ori Scope performance optimization","metricName":"ops_per_sec","metricUnit":"","bestDirection":"higher"}
{"run":1,"commit":"80b7cc0","metric":12317,"metrics":{"total_ms":129.9,"fork_join_ms":21.4,"channel_ms":18.4,"promise_ms":28,"semaphore_ms":15.8,"broadcast_ms":9.1,"select_ms":5.5,"nested_scopes_ms":17.1,"mixed_ms":11.5},"status":"keep","description":"Baseline: 12,317 ops/sec","timestamp":1774007413147,"segment":0,"confidence":null}
{"run":2,"commit":"8ff4898","metric":13981.2,"metrics":{"total_ms":114.4,"fork_join_ms":18.9,"channel_ms":16.4,"promise_ms":24.9,"semaphore_ms":14.1,"broadcast_ms":8.2,"select_ms":5,"nested_scopes_ms":14.8,"mixed_ms":10},"status":"keep","description":"Cache @state instead of thread-local lookup every call (+13.5%)","timestamp":1774007481801,"segment":0,"confidence":null}
{"run":3,"commit":"3a72042","metric":14167.8,"metrics":{"broadcast_ms":8.3,"channel_ms":16,"fork_join_ms":19.9,"mixed_ms":9.8,"nested_scopes_ms":15.3,"promise_ms":24.2,"select_ms":4.8,"semaphore_ms":14.1,"total_ms":112.9},"status":"keep","description":"Inline state accessors to @state.x (+1.3%)","timestamp":1774007507450,"segment":0,"confidence":9.91854233654884}
{"run":4,"commit":"ace86e4","metric":16139.9,"metrics":{"broadcast_ms":7.2,"channel_ms":13,"fork_join_ms":17.9,"mixed_ms":8.2,"nested_scopes_ms":14.1,"promise_ms":21.7,"select_ms":4.3,"semaphore_ms":12.6,"total_ms":99.1},"status":"keep","description":"Replace Lazy data structures with plain Hash/Array/Set (+14%)","timestamp":1774007557996,"segment":0,"confidence":4.131078452561056}
{"run":5,"commit":"14a9a33","metric":16848.3,"metrics":{"broadcast_ms":6.5,"channel_ms":11,"fork_join_ms":17.5,"mixed_ms":7,"nested_scopes_ms":13.2,"promise_ms":20.5,"select_ms":4.9,"semaphore_ms":12.7,"total_ms":95},"status":"keep","description":"Optimize pending_work?, cleanup_dead_fibers: no mutex, no allocs on fast path (+4.4%)","timestamp":1774007615619,"segment":0,"confidence":2.4482926302139623}
{"run":6,"commit":"866be6d","metric":16734,"metrics":{"broadcast_ms":6.5,"channel_ms":10.8,"fork_join_ms":17.7,"mixed_ms":6.8,"nested_scopes_ms":13.5,"promise_ms":20.6,"select_ms":4.9,"semaphore_ms":12.7,"total_ms":95.6},"status":"keep","description":"Add ready? to selectables, simplify process_blocked_fibers — no improvement (-0.7%)","timestamp":1774007666270,"segment":0,"confidence":3.292138913106655}
{"run":7,"commit":"7696285","metric":16645.5,"metrics":{"broadcast_ms":7,"channel_ms":11.2,"fork_join_ms":18.8,"mixed_ms":7.2,"nested_scopes_ms":14.6,"promise_ms":21.5,"select_ms":5.4,"semaphore_ms":13.3,"total_ms":96.1},"status":"keep","description":"Skip mutex in process_io_operations fast path — within noise (-0.5%)","timestamp":1774007703689,"segment":0,"confidence":6.396527385657823}
{"run":8,"commit":"ee8f64a","metric":18128.5,"metrics":{"broadcast_ms":6.6,"channel_ms":10.2,"fork_join_ms":16.6,"mixed_ms":6.5,"nested_scopes_ms":12.6,"promise_ms":18.8,"select_ms":4.6,"semaphore_ms":11.7,"total_ms":88.3},"status":"keep","description":"Skip fiber_ids lookup when not tracing, use Selectable match (+8.9%)","timestamp":1774007760391,"segment":0,"confidence":5.303915305284298}
{"run":9,"commit":"ee8f64a","metric":16669.4,"metrics":{"broadcast_ms":6.8,"channel_ms":11.2,"fork_join_ms":19.3,"mixed_ms":7.3,"nested_scopes_ms":14.7,"promise_ms":20.4,"select_ms":5.2,"semaphore_ms":13.3,"total_ms":96},"status":"checks_failed","description":"Inline cleanup on fiber completion — test failure in select (scheduling order changed)","timestamp":1774007824359,"segment":0,"confidence":11.49426424050632}
{"run":10,"commit":"52bcc52","metric":17991.5,"metrics":{"broadcast_ms":6.5,"channel_ms":10.6,"fork_join_ms":17.2,"mixed_ms":6.8,"nested_scopes_ms":13.1,"promise_ms":19.5,"select_ms":4.8,"semaphore_ms":12.2,"total_ms":88.9},"status":"keep","description":"Early return in process_blocked/timeouts when empty — within noise (-0.8%)","timestamp":1774007856614,"segment":0,"confidence":6.2772737092244535}
{"run":11,"commit":"52bcc52","metric":17765.9,"metrics":{"broadcast_ms":6.6,"channel_ms":10.6,"fork_join_ms":17.5,"mixed_ms":6.6,"nested_scopes_ms":13.2,"promise_ms":19.7,"select_ms":4.7,"semaphore_ms":11.9,"total_ms":90.1},"status":"discard","description":"Skip IO/timeout processing from process_available_work — no improvement (-1.3%)","timestamp":1774007910017,"segment":0,"confidence":5.300045599635203}
{"run":12,"commit":"52bcc52","metric":17685,"metrics":{"broadcast_ms":6.6,"channel_ms":10.9,"fork_join_ms":16,"mixed_ms":6.7,"nested_scopes_ms":12.4,"promise_ms":19.2,"select_ms":4.8,"semaphore_ms":11.9,"total_ms":90.5},"status":"discard","description":"Use Selectable is_a? in Task#resume instead of multi-class case — no improvement (-1.7%)","timestamp":1774007950033,"segment":0,"confidence":5.676678876678877}
{"run":13,"commit":"dacccfb","metric":18214.3,"metrics":{"broadcast_ms":6.8,"channel_ms":11,"fork_join_ms":17,"mixed_ms":6.3,"nested_scopes_ms":11.5,"promise_ms":19.2,"select_ms":4.5,"semaphore_ms":12.2,"total_ms":87.8},"status":"keep","description":"Remove thread_local_state registry — skip Thread.current lookups (+1.2%)","timestamp":1774007988131,"segment":0,"confidence":5.714991762767701}
{"run":14,"commit":"4158960","metric":20350.5,"metrics":{"broadcast_ms":5.6,"channel_ms":9.9,"fork_join_ms":16.2,"mixed_ms":5.8,"nested_scopes_ms":8.3,"promise_ms":18.4,"select_ms":3.4,"semaphore_ms":11,"total_ms":78.6},"status":"keep","description":"Lazily create IO.pipe only when IO operations needed (+11.7%)","timestamp":1774008059163,"segment":0,"confidence":7.3867868143993425}
{"run":15,"commit":"4158960","metric":20223.7,"metrics":{"broadcast_ms":5.6,"channel_ms":9.8,"fork_join_ms":15.9,"mixed_ms":5.8,"nested_scopes_ms":8.1,"promise_ms":18.6,"select_ms":3.1,"semaphore_ms":11.2,"total_ms":79.1},"status":"discard","description":"Lazily create Mutex — within noise, adds complexity (-0.6%)","timestamp":1774008108242,"segment":0,"confidence":7.027204338698386}
{"run":16,"commit":"a1d9853","metric":20383.7,"metrics":{"broadcast_ms":5.6,"channel_ms":9.4,"fork_join_ms":15.7,"mixed_ms":5.6,"nested_scopes_ms":8.4,"promise_ms":18.2,"select_ms":3.4,"semaphore_ms":10.9,"total_ms":78.5},"status":"keep","description":"Skip cleanup_dead_fibers when no fibers completed (+0.2%)","timestamp":1774008163111,"segment":0,"confidence":8.915943630837267}
{"run":17,"commit":"a1d9853","metric":20474.2,"metrics":{"broadcast_ms":5.7,"channel_ms":9.6,"fork_join_ms":15.9,"mixed_ms":5.8,"nested_scopes_ms":8.3,"promise_ms":18.8,"select_ms":3.3,"semaphore_ms":11.3,"total_ms":78.1},"status":"discard","description":"Swap-and-drain pending array instead of shift — within noise (+0.4%)","timestamp":1774008206179,"segment":0,"confidence":7.760173160173161}
{"run":18,"commit":"836f288","metric":20452.5,"metrics":{"broadcast_ms":5.3,"channel_ms":9.2,"fork_join_ms":16.1,"mixed_ms":6,"nested_scopes_ms":8.1,"promise_ms":18.2,"select_ms":3.2,"semaphore_ms":10.7,"total_ms":78.2},"status":"keep","description":"Defer current_time call until needed (+0.3%)","timestamp":1774008240272,"segment":0,"confidence":6.104295629337831}
{"run":19,"commit":"836f288","metric":20772.7,"metrics":{"broadcast_ms":5.5,"channel_ms":9.3,"fork_join_ms":15.6,"mixed_ms":5.4,"nested_scopes_ms":8.1,"promise_ms":18.3,"select_ms":3.2,"semaphore_ms":10.8,"total_ms":77},"status":"checks_failed","description":"Remove waiting.key? check from process_pending_fibers — 5 test failures","timestamp":1774008666042,"segment":0,"confidence":5.003382533825333}
{"run":20,"commit":"9907ccc","metric":20718.1,"metrics":{"broadcast_ms":5.8,"channel_ms":9.1,"fork_join_ms":15.7,"mixed_ms":5.7,"nested_scopes_ms":8.2,"promise_ms":18.4,"select_ms":3.3,"semaphore_ms":11.2,"total_ms":77.2},"status":"keep","description":"Inline task_queue lookup in hot paths, skip resume_fiber dispatch (+1.3%)","timestamp":1774008697207,"segment":0,"confidence":4.114354277878444}
{"run":21,"commit":"9e9dea0","metric":20963.5,"metrics":{"broadcast_ms":5.4,"channel_ms":9.3,"fork_join_ms":15.6,"mixed_ms":5.6,"nested_scopes_ms":8.1,"promise_ms":17.8,"select_ms":3.1,"semaphore_ms":10.5,"total_ms":76.3},"status":"keep","description":"Add resume_task() fast path skipping is_a? check (+1.2%)","timestamp":1774008768383,"segment":0,"confidence":3.8735328375593574}
{"run":22,"commit":"9e9dea0","metric":20918.9,"metrics":{"broadcast_ms":5.4,"channel_ms":8.9,"fork_join_ms":15.8,"mixed_ms":5.5,"nested_scopes_ms":8.2,"promise_ms":17.3,"select_ms":3.3,"semaphore_ms":10.7,"total_ms":76.5},"status":"discard","description":"Cache root_scope, use empty? instead of none? — within noise (-0.2%)","timestamp":1774008795011,"segment":0,"confidence":3.8824031251403164}
{"run":23,"commit":"f263674","metric":21102.3,"metrics":{"broadcast_ms":5.4,"channel_ms":9.3,"fork_join_ms":15.5,"mixed_ms":5.4,"nested_scopes_ms":8.2,"promise_ms":17.8,"select_ms":3.1,"semaphore_ms":10.7,"total_ms":75.8},"status":"keep","description":"Pre-compute Task id, initialize @cancellation_error (+0.7%)","timestamp":1774008826599,"segment":0,"confidence":3.9537803780378034}
{"run":24,"commit":"0c2bb47","metric":21161.8,"metrics":{"broadcast_ms":5.6,"channel_ms":9,"fork_join_ms":15.6,"mixed_ms":5.5,"nested_scopes_ms":8,"promise_ms":17.2,"select_ms":3.2,"semaphore_ms":10.8,"total_ms":75.6},"status":"keep","description":"Add Broadcast::Subscription to Task#resume case match (correctness fix)","timestamp":1774008852117,"segment":0,"confidence":4.028237008698822}
{"run":25,"commit":"3ccd2e4","metric":21327.9,"metrics":{"broadcast_ms":5.5,"channel_ms":9,"fork_join_ms":15.5,"mixed_ms":5.5,"nested_scopes_ms":7.8,"promise_ms":17.4,"select_ms":3,"semaphore_ms":10.6,"total_ms":75},"status":"keep","description":"Optimize Scope constructor: skip deadline/trace when not needed (+0.8%)","timestamp":1774008891885,"segment":0,"confidence":4.153636950308839}
{"run":26,"commit":"3ccd2e4","metric":21233.4,"metrics":{"broadcast_ms":5.4,"channel_ms":9.1,"fork_join_ms":15.7,"mixed_ms":5.4,"nested_scopes_ms":8,"promise_ms":17.2,"select_ms":3.1,"semaphore_ms":10.9,"total_ms":75.4},"status":"discard","description":"Avoid Fiber.current.blocking? by reusing parent check — no improvement (-0.4%)","timestamp":1774008923663,"segment":0,"confidence":5.2322029961676915}
{"run":27,"commit":"c4a16f4","metric":21358.4,"metrics":{"broadcast_ms":5.4,"channel_ms":8.9,"fork_join_ms":15.7,"mixed_ms":5.3,"nested_scopes_ms":8.1,"promise_ms":17.2,"select_ms":2.9,"semaphore_ms":10.6,"total_ms":74.9},"status":"keep","description":"Use delete_if in cleanup_dead_fibers — single pass (+0.1%)","timestamp":1774008955577,"segment":0,"confidence":7.968097294439055}
{"run":28,"commit":"c4a16f4","metric":21057.1,"metrics":{"broadcast_ms":5.7,"channel_ms":9.1,"fork_join_ms":15.8,"mixed_ms":5.6,"nested_scopes_ms":7.7,"promise_ms":17.8,"select_ms":3.1,"semaphore_ms":11,"total_ms":76},"status":"discard","description":"Simplify process_blocked_fibers (use resume_fiber), fix extra end — within noise (-1.4%)","timestamp":1774009042487,"segment":0,"confidence":8.561526442876735}
{"run":29,"commit":"0034861","metric":21800.1,"metrics":{"broadcast_ms":5.5,"channel_ms":9,"fork_join_ms":14.7,"mixed_ms":5.2,"nested_scopes_ms":7.6,"promise_ms":17.6,"select_ms":3.1,"semaphore_ms":10.7,"total_ms":73.4},"status":"keep","description":"Use single Selectable is_a? check in Task#resume instead of 5 classes (+2.1%)","timestamp":1774009095430,"segment":0,"confidence":9.408770711380082}
{"run":30,"commit":"9d77ce5","metric":21681.1,"metrics":{"broadcast_ms":5.4,"channel_ms":9.5,"fork_join_ms":15.1,"mixed_ms":5.5,"nested_scopes_ms":7.7,"promise_ms":17.2,"select_ms":3,"semaphore_ms":10.5,"total_ms":73.8},"status":"keep","description":"Remove dead thread_local_state method — clean up (-0.5%)","timestamp":1774009182661,"segment":0,"confidence":8.227215546783487}
{"run":31,"commit":"c975a91","metric":21988,"metrics":{"broadcast_ms":5.4,"channel_ms":9.1,"fork_join_ms":14.8,"mixed_ms":5.4,"nested_scopes_ms":7.9,"promise_ms":16.8,"select_ms":2.9,"semaphore_ms":10.5,"total_ms":72.8},"status":"keep","description":"Split await loop for parent/non-parent scopes — avoid parent_scope check (+1.4%)","timestamp":1774009208118,"segment":0,"confidence":7.454139047325433}
{"run":32,"commit":"3cf3561","metric":22698.6,"metrics":{"broadcast_ms":5.6,"channel_ms":7,"fork_join_ms":14.9,"mixed_ms":4.6,"nested_scopes_ms":7.7,"promise_ms":17.3,"select_ms":3,"semaphore_ms":10.5,"total_ms":70.5},"status":"keep","description":"Use empty? check for Channel value? instead of peek comparison (+3.2%)","timestamp":1774009242177,"segment":0,"confidence":7.8499810964083165}
{"run":33,"commit":"ba719a7","metric":22687.6,"metrics":{"broadcast_ms":5.6,"channel_ms":5.9,"fork_join_ms":14.9,"mixed_ms":4.3,"nested_scopes_ms":7.9,"promise_ms":17.6,"select_ms":3,"semaphore_ms":10.6,"total_ms":70.5},"status":"keep","description":"Inline UnboundedQueue — use plain array for channel buffer (channel -16%)","timestamp":1774009276968,"segment":0,"confidence":7.703769664588906}
{"run":34,"commit":"0c6be95","metric":22896.1,"metrics":{"broadcast_ms":5.5,"channel_ms":6,"fork_join_ms":15.7,"mixed_ms":4.5,"nested_scopes_ms":7.8,"promise_ms":17.7,"select_ms":2.9,"semaphore_ms":10.7,"total_ms":69.9},"status":"keep","description":"Skip fiber_ids lookup in cancel_fiber! when not tracing (+0.9%)","timestamp":1774009300546,"segment":0,"confidence":7.394352414901792}
{"run":35,"commit":"91ac0fa","metric":22858.4,"metrics":{"broadcast_ms":5.7,"channel_ms":5.6,"fork_join_ms":15.1,"mixed_ms":4.2,"nested_scopes_ms":7.5,"promise_ms":17.2,"select_ms":2.8,"semaphore_ms":10.8,"total_ms":70},"status":"keep","description":"Skip check_deadline! call entirely when no deadline — within noise (-0.2%)","timestamp":1774009320021,"segment":0,"confidence":6.988439688201878}
{"run":36,"commit":"dcf37c9","metric":23745.6,"metrics":{"broadcast_ms":5.9,"channel_ms":5.9,"fork_join_ms":15,"mixed_ms":4.7,"nested_scopes_ms":7.5,"promise_ms":17.5,"select_ms":3.1,"semaphore_ms":10.7,"total_ms":67.4},"status":"keep","description":"Inline create_task + register_task into fork (+3.9%)","timestamp":1774009350986,"segment":0,"confidence":6.5619383917549525}
{"run":37,"commit":"335ed17","metric":23815.9,"metrics":{"broadcast_ms":5.3,"channel_ms":5.9,"fork_join_ms":14.8,"mixed_ms":4.2,"nested_scopes_ms":7.6,"promise_ms":16.5,"select_ms":2.8,"semaphore_ms":10.1,"total_ms":67.2},"status":"keep","description":"Use symbol for Channel EMPTY sentinel (+0.3%)","timestamp":1774009384092,"segment":0,"confidence":5.838486925615639}
{"run":38,"commit":"335ed17","metric":23863.5,"metrics":{"broadcast_ms":5.3,"channel_ms":5.9,"fork_join_ms":14.8,"mixed_ms":4.2,"nested_scopes_ms":7.4,"promise_ms":16.5,"select_ms":2.8,"semaphore_ms":9.9,"total_ms":67},"status":"discard","description":"Inline process_pending/blocked into process_available_work (+0.2%)","timestamp":1774009416874,"segment":0,"confidence":5.903835292909595}
{"run":39,"commit":"335ed17","metric":23802.8,"metrics":{"broadcast_ms":5.2,"channel_ms":6,"fork_join_ms":14.5,"mixed_ms":4.2,"nested_scopes_ms":7.2,"promise_ms":16.5,"select_ms":2.7,"semaphore_ms":9.9,"total_ms":67.2},"status":"discard","description":"Use equal? for Channel sentinel — no improvement (symbol != is already fast)","timestamp":1774009444143,"segment":0,"confidence":5.970663066618212}
{"run":40,"commit":"da154d7","metric":23837.2,"metrics":{"broadcast_ms":5.3,"channel_ms":5.7,"fork_join_ms":14.5,"mixed_ms":4.4,"nested_scopes_ms":7.6,"promise_ms":17.1,"select_ms":2.8,"semaphore_ms":10,"total_ms":67.1},"status":"keep","description":"Inline available? check in Semaphore#acquire (+0.1%)","timestamp":1774009471800,"segment":0,"confidence":5.960676773425787}
{"run":41,"commit":"9901972","metric":23847.9,"metrics":{"broadcast_ms":5.2,"channel_ms":5.5,"fork_join_ms":14.5,"mixed_ms":4.5,"nested_scopes_ms":7.3,"promise_ms":16.3,"select_ms":2.7,"semaphore_ms":9.8,"total_ms":67.1},"status":"keep","description":"Inline resolved? in Promise#await (+0.04%)","timestamp":1774009491576,"segment":0,"confidence":5.94529517916989}
{"run":42,"commit":"c222838","metric":23884.5,"metrics":{"broadcast_ms":5.4,"channel_ms":5.8,"fork_join_ms":14.8,"mixed_ms":3.9,"nested_scopes_ms":7.3,"promise_ms":16.5,"select_ms":2.8,"semaphore_ms":10,"total_ms":67},"status":"keep","description":"Lazily create @pending_interrupts hash (+0.2%)","timestamp":1774009530257,"segment":0,"confidence":5.974794039410141}
{"run":43,"commit":"c222838","metric":23809.2,"metrics":{"broadcast_ms":5.4,"channel_ms":5.8,"fork_join_ms":14.7,"mixed_ms":3.9,"nested_scopes_ms":7.3,"promise_ms":16.6,"select_ms":2.8,"semaphore_ms":10.1,"total_ms":67.2},"status":"discard","description":"Clear @state in await ensure — no improvement (-0.3%)","timestamp":1774009575524,"segment":0,"confidence":5.985460002069755}
{"run":44,"commit":"ad5c9fb","metric":23970,"metrics":{"broadcast_ms":5.5,"channel_ms":6.3,"fork_join_ms":14.7,"mixed_ms":4.3,"nested_scopes_ms":7.3,"promise_ms":17,"select_ms":2.8,"semaphore_ms":10,"total_ms":66.7},"status":"keep","description":"Remove @killed ivar from Task — derive from fiber state (+0.4%)","timestamp":1774009598166,"segment":0,"confidence":5.043387937936856}
{"run":45,"commit":"37ac57b","metric":24073.2,"metrics":{"broadcast_ms":5.3,"channel_ms":5.6,"fork_join_ms":14.3,"mixed_ms":4.1,"nested_scopes_ms":7.2,"promise_ms":16.5,"select_ms":2.8,"semaphore_ms":9.9,"total_ms":66.5},"status":"keep","description":"Optimize close_scope — single nil check instead of 4 safe navigations (+0.4%)","timestamp":1774009634727,"segment":0,"confidence":4.372772921703552}
{"run":46,"commit":"3299db3","metric":24255.3,"metrics":{"broadcast_ms":5.4,"channel_ms":5.7,"fork_join_ms":14.5,"mixed_ms":4.2,"nested_scopes_ms":7.5,"promise_ms":16.8,"select_ms":2.8,"semaphore_ms":10,"total_ms":66},"status":"keep","description":"Use attr_reader for Task#id instead of explicit method (+0.8%)","timestamp":1774009678836,"segment":0,"confidence":4.430617925403596}
{"run":47,"commit":"df30a6f","metric":24355.7,"metrics":{"broadcast_ms":5.3,"channel_ms":6.2,"fork_join_ms":14.9,"mixed_ms":4.1,"nested_scopes_ms":7.3,"promise_ms":16.7,"select_ms":2.6,"semaphore_ms":10,"total_ms":65.7},"status":"keep","description":"Remove cancellation_error check from Task#resume hot path (+0.4%)","timestamp":1774009705337,"segment":0,"confidence":4.457952231068321}
{"run":48,"commit":"006e069","metric":24114.5,"metrics":{"broadcast_ms":5.3,"channel_ms":5.5,"fork_join_ms":14.4,"mixed_ms":4.2,"nested_scopes_ms":7.3,"promise_ms":15.9,"select_ms":2.7,"semaphore_ms":9.7,"total_ms":66.4},"status":"keep","description":"Remove @cancellation_error ivar from Task constructor (-1.0%)","timestamp":1774009725678,"segment":0,"confidence":4.502215823033339}
{"run":49,"commit":"006e069","metric":24343.9,"metrics":{"broadcast_ms":5.3,"channel_ms":5.6,"fork_join_ms":14.3,"mixed_ms":4.3,"nested_scopes_ms":7.2,"promise_ms":16.5,"select_ms":2.8,"semaphore_ms":10,"total_ms":65.7},"status":"discard","description":"Confirmation run — stable at ~24.3k ops/sec (+97.6%)","timestamp":1774009796781,"segment":0,"confidence":4.547367228223916}
{"run":50,"commit":"c324c62","metric":24415.2,"metrics":{"broadcast_ms":5.2,"channel_ms":5.6,"fork_join_ms":14.2,"mixed_ms":4.1,"nested_scopes_ms":7.2,"promise_ms":16.4,"select_ms":2.7,"semaphore_ms":10,"total_ms":65.5},"status":"keep","description":"Remove redundant check_deadline! from process_timeouts, fix duplicate empty? check (+1.2%)","timestamp":1774009837040,"segment":0,"confidence":4.6265511768867436}
{"run":51,"commit":"6986dd6","metric":24486.2,"metrics":{"broadcast_ms":5.4,"channel_ms":5.7,"fork_join_ms":14.8,"mixed_ms":3.9,"nested_scopes_ms":7.3,"promise_ms":16.4,"select_ms":2.7,"semaphore_ms":9.8,"total_ms":65.3},"status":"keep","description":"Remove unused HASH_SET_LAMBDA constant (+0.3%)","timestamp":1774009860344,"segment":0,"confidence":4.712178121974831}
{"run":52,"commit":"8d5686b","metric":25638.1,"metrics":{"broadcast_ms":5.1,"channel_ms":5.6,"fork_join_ms":13.6,"mixed_ms":3.9,"nested_scopes_ms":7,"promise_ms":15.6,"select_ms":2.7,"semaphore_ms":9,"total_ms":62.4},"status":"keep","description":"Merge fiber_ids and task_queue into single hash — eliminate duplicate hash ops (+4.7%)","timestamp":1774009998103,"segment":0,"confidence":5.232373620330728}
{"run":53,"commit":"8d5686b","metric":25507,"metrics":{"broadcast_ms":5.3,"channel_ms":5.6,"fork_join_ms":14.2,"mixed_ms":4,"nested_scopes_ms":7,"promise_ms":15.7,"select_ms":2.5,"semaphore_ms":9.2,"total_ms":62.7},"status":"discard","description":"Confirmation run at 25,507 ops/sec (+107.1%)","timestamp":1774010064590,"segment":0,"confidence":5.308691666998765}
{"run":54,"commit":"8d5686b","metric":25371.5,"metrics":{"total_ms":63.1,"fork_join_ms":14.2,"channel_ms":5.6,"promise_ms":15.6,"semaphore_ms":9.1,"broadcast_ms":5.2,"select_ms":2.5,"nested_scopes_ms":7.1,"mixed_ms":3.9},"status":"discard","description":"Confirmation run after resume — stable at ~25.4k","timestamp":1774010132421,"segment":0,"confidence":5.329719132591822}
{"run":55,"commit":"768aaee","metric":25779.8,"metrics":{"broadcast_ms":5,"channel_ms":5.8,"fork_join_ms":13.7,"mixed_ms":3.9,"nested_scopes_ms":6.9,"promise_ms":15.4,"select_ms":2.5,"semaphore_ms":9.3,"total_ms":62.1},"status":"keep","description":"Eliminate ThreadLocalState indirection — cache collections as Scope ivars (+0.6%)","timestamp":1774010195162,"segment":0,"confidence":5.407832898172323}
{"run":56,"commit":"768aaee","metric":23321.6,"metrics":{"broadcast_ms":5.3,"channel_ms":6.2,"fork_join_ms":14.5,"mixed_ms":4.2,"nested_scopes_ms":7.3,"promise_ms":16.8,"select_ms":2.7,"semaphore_ms":10,"total_ms":68.6},"status":"checks_failed","description":"blocked_dirty flag to skip process_blocked_fibers — checks timeout (missed wakeups)","timestamp":1774010845960,"segment":0,"confidence":5.7959359393835}
