{"run":57,"commit":"768aaee","metric":23413,"metrics":{"broadcast_ms":5.5,"channel_ms":6.1,"fork_join_ms":15.3,"mixed_ms":4.2,"nested_scopes_ms":7.7,"promise_ms":16.9,"select_ms":2.7,"semaphore_ms":10.1,"total_ms":68.3},"status":"discard","description":"Inline all accessor ivars in hot paths — unexpectedly worse (-9.3%), YJIT prefers methods","timestamp":1774010939281,"segment":0,"confidence":6.244051760122437}
{"run":58,"commit":"2f2724d","metric":23256.8,"metrics":{"broadcast_ms":6,"channel_ms":6,"fork_join_ms":15.2,"mixed_ms":4.2,"nested_scopes_ms":7.6,"promise_ms":17.6,"select_ms":1.5,"semaphore_ms":10.4,"total_ms":68.8},"status":"keep","description":"Fast-path in Select.await — return immediately if resource ready (select -48%, system load noisy)","timestamp":1774010999957,"segment":0,"confidence":6.454037728612854}
{"run":59,"commit":"96bd072","metric":23416.1,"metrics":{"broadcast_ms":6,"channel_ms":6,"fork_join_ms":15.1,"mixed_ms":4.3,"nested_scopes_ms":7.6,"promise_ms":17.7,"select_ms":1.5,"semaphore_ms":10,"total_ms":68.3},"status":"keep","description":"Remove respond_to? check in Select — all Selectables have ready? (+0.7%)","timestamp":1774011032975,"segment":0,"confidence":6.678638753844617}
{"run":60,"commit":"60f9381","metric":23742,"metrics":{"broadcast_ms":5.4,"channel_ms":6.4,"fork_join_ms":15.8,"mixed_ms":4.2,"nested_scopes_ms":7.6,"promise_ms":17.2,"select_ms":1.4,"semaphore_ms":10.5,"total_ms":67.4},"status":"keep","description":"Use integer flags instead of hash allocation in register_io_wait (+1.4%)","timestamp":1774011080005,"segment":0,"confidence":7.017357310398742}
{"run":61,"commit":"38ed43b","metric":23359.4,"metrics":{"broadcast_ms":6.4,"channel_ms":6.1,"fork_join_ms":15.4,"mixed_ms":4.3,"nested_scopes_ms":7.7,"promise_ms":17.5,"select_ms":1.3,"semaphore_ms":10.1,"total_ms":68.5},"status":"keep","description":"Use @closed ivar directly instead of closed? method call","timestamp":1774011133226,"segment":0,"confidence":7.3922688337359945}
{"run":62,"commit":"38ed43b","metric":23408.9,"metrics":{"broadcast_ms":6.1,"channel_ms":6,"fork_join_ms":15.4,"mixed_ms":4.2,"nested_scopes_ms":7.5,"promise_ms":17.5,"select_ms":1.4,"semaphore_ms":10.5,"total_ms":68.4},"status":"discard","description":"Replace case/when with if/is_a? in resume_task — no improvement","timestamp":1774011197953,"segment":0,"confidence":8.45440844009043}
{"run":63,"commit":"1cf913c","metric":24805.8,"metrics":{"broadcast_ms":5.9,"channel_ms":5.9,"fork_join_ms":14.5,"mixed_ms":3.9,"nested_scopes_ms":7,"promise_ms":16.2,"select_ms":1.1,"semaphore_ms":9.3,"total_ms":64.5},"status":"keep","description":"Inline fiber.resume in resume_task, skip Task#resume double dispatch (+6.4% vs control)","timestamp":1774011359000,"segment":0,"confidence":8.256853725850965}
{"run":64,"commit":"1cf913c","metric":0,"metrics":{"broadcast_ms":0,"channel_ms":0,"fork_join_ms":0,"mixed_ms":0,"nested_scopes_ms":0,"promise_ms":0,"select_ms":0,"semaphore_ms":0,"total_ms":0},"status":"crash","description":"delete_if in process_blocked_fibers — hangs (mutating hash during iteration)","timestamp":1774011803361,"segment":0,"confidence":8.256853725850965}
{"run":65,"commit":"6a1acea","metric":25003.9,"metrics":{"broadcast_ms":5.3,"channel_ms":6.1,"fork_join_ms":14.9,"mixed_ms":4.1,"nested_scopes_ms":7.1,"promise_ms":16.4,"select_ms":0.9,"semaphore_ms":9.6,"total_ms":64},"status":"keep","description":"Add 30s timeout to benchmark runs, confirmation at ~25k","timestamp":1774012078723,"segment":0,"confidence":8.192040890836063}
{"run":66,"commit":"5225f7c","metric":25041.1,"metrics":{"broadcast_ms":5.2,"channel_ms":5.8,"fork_join_ms":14.4,"mixed_ms":4.1,"nested_scopes_ms":7,"promise_ms":15.6,"select_ms":1.1,"semaphore_ms":9.5,"total_ms":63.9},"status":"keep","description":"Avoid array alloc in nearest_timeout_at, use empty? in check_stalled_fibers!","timestamp":1774012126662,"segment":0,"confidence":8.182580684373656}
{"run":67,"commit":"4050cd0","metric":25238.2,"metrics":{"broadcast_ms":5.3,"channel_ms":5.9,"fork_join_ms":14.8,"mixed_ms":3.9,"nested_scopes_ms":6.8,"promise_ms":16.2,"select_ms":1.1,"semaphore_ms":9.5,"total_ms":63.4},"status":"keep","description":"Optimize Ori.sync — reuse parent check instead of Fiber.current.blocking? (+0.8%)","timestamp":1774012161183,"segment":0,"confidence":8.127501584714295}
{"run":68,"commit":"e008401","metric":25199.2,"metrics":{"broadcast_ms":5.4,"channel_ms":5.8,"fork_join_ms":14.4,"mixed_ms":3.9,"nested_scopes_ms":6.9,"promise_ms":16,"select_ms":0.9,"semaphore_ms":9.5,"total_ms":63.5},"status":"keep","description":"Replace Hash#fetch with [] + resume_task dispatch in resume_fiber (-0.2%)","timestamp":1774012193963,"segment":0,"confidence":7.935164446540129}
{"run":69,"commit":"7bb5c54","metric":24667.8,"metrics":{"broadcast_ms":5.5,"channel_ms":5.9,"fork_join_ms":14.1,"mixed_ms":4.1,"nested_scopes_ms":7.2,"promise_ms":16,"select_ms":1,"semaphore_ms":9.6,"total_ms":64.9},"status":"keep","description":"Remove unused require 'ori/lazy' — cleanup dead dependency","timestamp":1774012232181,"segment":0,"confidence":7.714187485674991}
{"run":70,"commit":"bf805bb","metric":25020.3,"metrics":{"broadcast_ms":5.2,"channel_ms":5.9,"fork_join_ms":14.3,"mixed_ms":3.8,"nested_scopes_ms":7.4,"promise_ms":16.2,"select_ms":1.1,"semaphore_ms":9.9,"total_ms":63.9},"status":"keep","description":"Remove dead ThreadLocalState class and state method (+1.4%)","timestamp":1774012315597,"segment":0,"confidence":7.598803409155045}
{"run":71,"commit":"9359396","metric":25321.3,"metrics":{"broadcast_ms":5.3,"channel_ms":5.9,"fork_join_ms":14.9,"mixed_ms":3.9,"nested_scopes_ms":6.9,"promise_ms":16.2,"select_ms":1.2,"semaphore_ms":9.7,"total_ms":63.2},"status":"keep","description":"Skip process_io_operations for scopes with no IO operations (+1.2%)","timestamp":1774012414733,"segment":0,"confidence":7.16544694893154}
{"run":72,"commit":"9359396","metric":25156.4,"metrics":{"broadcast_ms":5,"channel_ms":6,"fork_join_ms":14.4,"mixed_ms":4,"nested_scopes_ms":6.9,"promise_ms":16,"select_ms":1.4,"semaphore_ms":9.7,"total_ms":63.6},"status":"discard","description":"Confirmation run — stable at ~25.2k (+104.2%)","timestamp":1774012485990,"segment":0,"confidence":7.091656131479148}
{"run":73,"commit":"0d4b778","metric":25209.6,"metrics":{"broadcast_ms":5.4,"channel_ms":5.9,"fork_join_ms":14.4,"mixed_ms":3.9,"nested_scopes_ms":6.8,"promise_ms":16.1,"select_ms":1.1,"semaphore_ms":9.4,"total_ms":63.5},"status":"keep","description":"Skip waiting.key? check when no timeouts registered — marginal","timestamp":1774012528093,"segment":0,"confidence":7.1284549401673045}
{"run":74,"commit":"0d4b778","metric":25373.5,"metrics":{"broadcast_ms":4.9,"channel_ms":5.9,"fork_join_ms":14.3,"mixed_ms":3.8,"nested_scopes_ms":7,"promise_ms":16,"select_ms":1.1,"semaphore_ms":9.8,"total_ms":63.1},"status":"checks_failed","description":"Remove nil check for task_queue lookup — 4 test errors (some fibers lack tasks)","timestamp":1774012607458,"segment":0,"confidence":7.170217298679156}
{"run":75,"commit":"7794f77","metric":25479.7,"metrics":{"broadcast_ms":5.4,"channel_ms":5.6,"fork_join_ms":14.3,"mixed_ms":3.6,"nested_scopes_ms":7.2,"promise_ms":15.9,"select_ms":1.1,"semaphore_ms":9.8,"total_ms":62.8},"status":"keep","description":"Lazily create Mutex — avoid allocation for non-IO scopes (+1.1%)","timestamp":1774012661944,"segment":0,"confidence":7.222919684532433}
{"run":76,"commit":"4eb2f33","metric":25372.3,"metrics":{"broadcast_ms":5.2,"channel_ms":5.8,"fork_join_ms":14.4,"mixed_ms":4,"nested_scopes_ms":6.9,"promise_ms":15.9,"select_ms":1.1,"semaphore_ms":9.6,"total_ms":63.1},"status":"keep","description":"Use resume_fiber in process_pending/blocked — simplify dispatch (-0.4%)","timestamp":1774012744145,"segment":0,"confidence":7.27640255107557}
{"run":77,"commit":"4eb2f33","metric":25363,"metrics":{"broadcast_ms":5.2,"channel_ms":6.1,"fork_join_ms":14.6,"mixed_ms":3.9,"nested_scopes_ms":7.1,"promise_ms":15.9,"select_ms":1.1,"semaphore_ms":9.5,"total_ms":63.1},"status":"discard","description":"Final confirmation — stable at 25.4k (+105.9%)","timestamp":1774012774739,"segment":0,"confidence":7.317733387688551}
{"run":78,"commit":"4eb2f33","metric":25041.5,"metrics":{"broadcast_ms":5.4,"channel_ms":6,"fork_join_ms":14.4,"mixed_ms":4.1,"nested_scopes_ms":6.9,"promise_ms":16.4,"select_ms":1.1,"semaphore_ms":9.9,"total_ms":63.9},"status":"discard","description":"Check ready? on yield to skip blocked — extra check adds overhead, no gain (-1.3%)","timestamp":1774012816884,"segment":0,"confidence":7.476425834397746}
{"run":79,"commit":"4eb2f33","metric":25033.2,"metrics":{"broadcast_ms":5.2,"channel_ms":5.8,"fork_join_ms":14.6,"mixed_ms":4.1,"nested_scopes_ms":6.9,"promise_ms":16.2,"select_ms":1.1,"semaphore_ms":9.9,"total_ms":63.9},"status":"discard","description":"Confirmation after resume — 25k stable","timestamp":1774012862186,"segment":0,"confidence":7.5066491956843}
{"run":80,"commit":"4eb2f33","metric":24805.4,"metrics":{"broadcast_ms":5.3,"channel_ms":6.1,"fork_join_ms":14.6,"mixed_ms":4,"nested_scopes_ms":7,"promise_ms":16.5,"select_ms":1.2,"semaphore_ms":9.5,"total_ms":64.5},"status":"discard","description":"Track live fiber count, fast-clear when all dead — within noise (-0.9%)","timestamp":1774012920277,"segment":0,"confidence":7.5371179039301275}
{"run":81,"commit":"f70a2db","metric":25543.6,"metrics":{"broadcast_ms":5.3,"channel_ms":5.6,"fork_join_ms":14.4,"mixed_ms":3.6,"nested_scopes_ms":6.8,"promise_ms":15.9,"select_ms":1.1,"semaphore_ms":9.7,"total_ms":62.6},"status":"keep","description":"Skip cleanup_dead_fibers for non-IO scopes — dead fibers in task_queue are harmless (+1.8%)","timestamp":1774012961695,"segment":0,"confidence":7.521747632483167}
{"run":82,"commit":"f70a2db","metric":25526.5,"metrics":{"broadcast_ms":5.3,"channel_ms":5.7,"fork_join_ms":14.4,"mixed_ms":3.7,"nested_scopes_ms":6.9,"promise_ms":16,"select_ms":0.9,"semaphore_ms":9.5,"total_ms":62.7},"status":"discard","description":"Swap-and-iterate pending array — within noise (-0.1%)","timestamp":1774012997165,"segment":0,"confidence":7.5064399219403395}
{"run":83,"commit":"283b69a","metric":25988.8,"metrics":{"broadcast_ms":5.4,"channel_ms":6.2,"fork_join_ms":14,"mixed_ms":3.6,"nested_scopes_ms":6.6,"promise_ms":15.9,"select_ms":1,"semaphore_ms":9.4,"total_ms":61.6},"status":"keep","description":"Remove default proc from readable/writable hashes — avoid closure allocation per scope (+1.7%)","timestamp":1774013049903,"segment":0,"confidence":7.76542087924571}
{"run":84,"commit":"283b69a","metric":25812.7,"metrics":{"broadcast_ms":5.2,"channel_ms":6,"fork_join_ms":14,"mixed_ms":3.6,"nested_scopes_ms":6.8,"promise_ms":15.8,"select_ms":0.9,"semaphore_ms":9.3,"total_ms":62},"status":"checks_failed","description":"Lazily create @wakeup_queue — 5 test errors (block/yield path needs queue)","timestamp":1774013178972,"segment":0,"confidence":8.390181037127952}
{"run":85,"commit":"283b69a","metric":24649.5,"metrics":{"broadcast_ms":5.5,"channel_ms":5.6,"fork_join_ms":15,"mixed_ms":3.4,"nested_scopes_ms":7.3,"promise_ms":16.5,"select_ms":1.1,"semaphore_ms":10.1,"total_ms":64.9},"status":"discard","description":"Explicit blocking: false in Fiber.new — adds kwarg overhead (-3.6%)","timestamp":1774013226248,"segment":0,"confidence":8.421448150543592}
{"run":86,"commit":"283b69a","metric":25796,"metrics":{"broadcast_ms":5,"channel_ms":5.8,"fork_join_ms":14.4,"mixed_ms":3.5,"nested_scopes_ms":6.8,"promise_ms":15.4,"select_ms":0.9,"semaphore_ms":9.2,"total_ms":62},"status":"discard","description":"Confirmation at ~25.8k (+109.4%)","timestamp":1774013311016,"segment":0,"confidence":8.408758226213166}
{"run":87,"commit":"e66f026","metric":26247.6,"metrics":{"broadcast_ms":5.3,"channel_ms":5.5,"fork_join_ms":14.6,"mixed_ms":3.5,"nested_scopes_ms":6.8,"promise_ms":15.6,"select_ms":1.1,"semaphore_ms":9.9,"total_ms":61},"status":"keep","description":"Inline Semaphore#sync fast path — avoid acquire/release calls when non-contended (+2.7%)","timestamp":1774013349350,"segment":0,"confidence":8.719158790761705}
{"run":88,"commit":"d1c2f1a","metric":26649.8,"metrics":{"broadcast_ms":5,"channel_ms":4.9,"fork_join_ms":14.4,"mixed_ms":3.6,"nested_scopes_ms":6.5,"promise_ms":15.6,"select_ms":1.1,"semaphore_ms":8.7,"total_ms":60},"status":"keep","description":"Inline Channel fast path for put/take when buffer available (+1.5%)","timestamp":1774013385326,"segment":0,"confidence":9.132080280344057}
{"run":89,"commit":"b0da222","metric":26515.1,"metrics":{"broadcast_ms":5.4,"channel_ms":4.9,"fork_join_ms":14,"mixed_ms":3.3,"nested_scopes_ms":6.8,"promise_ms":15.6,"select_ms":1,"semaphore_ms":8.9,"total_ms":60.3},"status":"keep","description":"Inline value? in take_buffered/peek_buffered — within noise (-0.5%)","timestamp":1774013411906,"segment":0,"confidence":9.14723339077159}
